{
  "$schema": "https://json-schema.org/draft/2020-12/schema",
  "$id": "https://kopanolabs.com/schemas/kpgs/agent-governance/mmao-mao/failure-receipt.schema.json",
  "title": "KPGS MMAO + MAO Failure and Five Whys Receipt",
  "type": "object",
  "additionalProperties": false,
  "required": [
    "schema_version",
    "receipt_id",
    "receipt_status",
    "expected_behavior",
    "actual_behavior",
    "identity",
    "seat",
    "model",
    "interface",
    "repository_state",
    "action_tool_trace",
    "evidence_refs",
    "failure_class",
    "five_whys",
    "correction",
    "retest",
    "rtc_reviews",
    "review_aggregation"
  ],
  "properties": {
    "schema_version": {
      "const": "kpgs.mmao-mao.failure-receipt.v1"
    },
    "receipt_id": {
      "type": "string",
      "minLength": 8
    },
    "receipt_status": {
      "type": "string",
      "enum": [
        "synthetic-fixture",
        "observed",
        "retested",
        "held"
      ]
    },
    "expected_behavior": {
      "type": "string",
      "minLength": 1
    },
    "actual_behavior": {
      "type": "string",
      "minLength": 1
    },
    "identity": {
      "type": "object",
      "additionalProperties": false,
      "required": [
        "identity_id",
        "provenance_ref"
      ],
      "properties": {
        "identity_id": {
          "type": "string",
          "minLength": 1
        },
        "provenance_ref": {
          "type": "string",
          "minLength": 1
        }
      }
    },
    "seat": {
      "type": "object",
      "additionalProperties": false,
      "required": [
        "seat_id",
        "authority_scope"
      ],
      "properties": {
        "seat_id": {
          "type": "string",
          "minLength": 1
        },
        "authority_scope": {
          "type": "string",
          "enum": [
            "task-scoped",
            "global-structural-maintenance"
          ]
        }
      }
    },
    "model": {
      "type": "object",
      "additionalProperties": false,
      "required": [
        "provider",
        "model_id",
        "model_version"
      ],
      "properties": {
        "provider": {
          "type": "string",
          "minLength": 1
        },
        "model_id": {
          "type": "string",
          "minLength": 1
        },
        "model_version": {
          "type": [
            "string",
            "null"
          ]
        }
      }
    },
    "interface": {
      "type": "object",
      "additionalProperties": false,
      "required": [
        "interface_id",
        "interface_version"
      ],
      "properties": {
        "interface_id": {
          "type": "string",
          "minLength": 1
        },
        "interface_version": {
          "type": [
            "string",
            "null"
          ]
        }
      }
    },
    "repository_state": {
      "type": "object",
      "additionalProperties": false,
      "required": [
        "repository",
        "commit_sha",
        "now_ref"
      ],
      "properties": {
        "repository": {
          "type": "string",
          "minLength": 1
        },
        "commit_sha": {
          "type": "string",
          "pattern": "^[a-f0-9]{40}$"
        },
        "now_ref": {
          "type": "string",
          "minLength": 1
        }
      }
    },
    "action_tool_trace": {
      "type": "object",
      "additionalProperties": false,
      "required": [
        "capture_mode",
        "trace_ref",
        "steps"
      ],
      "properties": {
        "capture_mode": {
          "const": "metadata-only"
        },
        "trace_ref": {
          "type": "string",
          "minLength": 1
        },
        "steps": {
          "type": "array",
          "minItems": 1,
          "items": {
            "type": "string",
            "minLength": 1
          }
        }
      }
    },
    "evidence_refs": {
      "type": "array",
      "minItems": 1,
      "items": {
        "type": "object",
        "additionalProperties": false,
        "required": [
          "class",
          "ref"
        ],
        "properties": {
          "class": {
            "type": "string",
            "enum": [
              "repository-state",
              "schema",
              "test",
              "tool-trace",
              "runtime",
              "human-observation",
              "external-system"
            ]
          },
          "ref": {
            "type": "string",
            "minLength": 1
          },
          "sha256": {
            "type": [
              "string",
              "null"
            ],
            "pattern": "^[a-f0-9]{64}$"
          }
        }
      }
    },
    "failure_class": {
      "type": "string",
      "enum": [
        "model-deficiency",
        "interface-deficiency",
        "model-interface-mismatch",
        "context-packaging-failure",
        "role-mismatch",
        "governance-failure",
        "identity-drift",
        "temporal-state-confusion",
        "scope-breach",
        "other"
      ]
    },
    "five_whys": {
      "type": "array",
      "minItems": 5,
      "maxItems": 5,
      "items": {
        "type": "object",
        "additionalProperties": false,
        "required": [
          "index",
          "question",
          "answer",
          "evidence_refs",
          "state"
        ],
        "properties": {
          "index": {
            "type": "integer",
            "minimum": 1,
            "maximum": 5
          },
          "question": {
            "type": "string",
            "minLength": 1
          },
          "answer": {
            "type": "string",
            "minLength": 1
          },
          "evidence_refs": {
            "type": "array",
            "minItems": 1,
            "items": {
              "type": "string",
              "minLength": 1
            }
          },
          "state": {
            "type": "string",
            "enum": [
              "observed",
              "inferred",
              "unknown"
            ]
          }
        }
      }
    },
    "correction": {
      "type": "object",
      "additionalProperties": false,
      "required": [
        "action",
        "owner",
        "scope",
        "state"
      ],
      "properties": {
        "action": {
          "type": "string",
          "minLength": 1
        },
        "owner": {
          "type": "string",
          "minLength": 1
        },
        "scope": {
          "type": "string",
          "minLength": 1
        },
        "state": {
          "type": "string",
          "enum": [
            "proposed",
            "applied",
            "verified"
          ]
        }
      }
    },
    "retest": {
      "type": "object",
      "additionalProperties": false,
      "required": [
        "status",
        "outcome",
        "evidence_refs"
      ],
      "properties": {
        "status": {
          "type": "string",
          "enum": [
            "not-run",
            "passed",
            "failed",
            "held"
          ]
        },
        "outcome": {
          "type": "string",
          "minLength": 1
        },
        "evidence_refs": {
          "type": "array",
          "items": {
            "type": "string",
            "minLength": 1
          }
        }
      }
    },
    "rtc_reviews": {
      "type": "array",
      "items": {
        "type": "object",
        "additionalProperties": false,
        "required": [
          "reviewer_identity",
          "seat",
          "independence",
          "conclusion",
          "evidence_refs",
          "status"
        ],
        "properties": {
          "reviewer_identity": {
            "type": "string",
            "minLength": 1
          },
          "seat": {
            "type": "string",
            "minLength": 1
          },
          "independence": {
            "const": "independent-evidence-review"
          },
          "conclusion": {
            "type": "string",
            "enum": [
              "support",
              "challenge",
              "hold"
            ]
          },
          "evidence_refs": {
            "type": "array",
            "minItems": 1,
            "items": {
              "type": "string",
              "minLength": 1
            }
          },
          "status": {
            "type": "string",
            "enum": [
              "planned",
              "completed"
            ]
          }
        }
      }
    },
    "review_aggregation": {
      "type": "object",
      "additionalProperties": false,
      "required": [
        "mode",
        "decision_rule"
      ],
      "properties": {
        "mode": {
          "const": "evidence-convergence-not-vote"
        },
        "decision_rule": {
          "const": "unsupported-claims-remain-held"
        }
      }
    }
  }
}
